<!--
  - Copyright 2026 Oracle and/or its affiliates
  -
  - Licensed under the Apache License, Version 2.0 (the "License");
  - you may not use this file except in compliance with the License.
  - You may obtain a copy of the License at
  -
  - https://www.apache.org/licenses/LICENSE-2.0
  -
  - Unless required by applicable law or agreed to in writing, software
  - distributed under the License is distributed on an "AS IS" BASIS,
  - WITHOUT WARRANTIES OR CONDITIONS OF ANY KIND, either express or implied.
  - See the License for the specific language governing permissions and
  - limitations under the License.
  -->

<!ELEMENT parser-element-extensions (one-of-extension)*>
<!ATTLIST parser-element-extensions
        language CDATA #REQUIRED
        source CDATA #REQUIRED
        builder-version CDATA #REQUIRED>

<!ELEMENT one-of-extension (node)*>
<!ATTLIST one-of-extension
        id CDATA #REQUIRED
        depth CDATA #REQUIRED>

<!ELEMENT node (node)*>
<!ATTLIST node
        id CDATA #IMPLIED
        ref CDATA #IMPLIED
        tt CDATA #IMPLIED
        pc CDATA #IMPLIED
        cc CDATA #IMPLIED>
